Category_Name,Category_Img,Category_Desc
Indian,https://www.kayak.co.uk/news/wp-content/uploads/sites/5/2022/10/THEME_FOOD_INDIAN-CUISINE-GettyImages-526749337-1.jpg,"Rich, aromatic dishes featuring complex spice blends, diverse regional specialties, and a harmonious balance of flavors. Known for curries, tandoori specialties, and vegetarian options."
Italian,https://tse2.mm.bing.net/th?id=OIP.Nf5Nb7lxW0N9HXnqlgouTQHaE8&pid=Api&P=0&h=180,"Celebrated for its simplicity and quality ingredients. Features regional pasta dishes, wood-fired pizzas, risottos, and a variety of cheeses and cured meats. Emphasizes fresh herbs and olive oil."
Chinese,https://tse3.mm.bing.net/th?id=OIP.ApF_riFu-sMkBd8CEAvOcAHaFE&pid=Api&P=0&h=180,"Diverse culinary traditions spanning thousands of years. Known for its balance of flavors, use of fresh ingredients, and cooking techniques like stir-frying and steaming. Features dumplings, noodles, and regional specialties."
Mexican,https://tse1.mm.bing.net/th?id=OIP.5WIT_pN7XC_lo8zyjtNgjwHaE7&pid=Api&P=0&h=180,"Vibrant cuisine blending indigenous and Spanish influences. Known for bold flavors, use of chili peppers, corn-based dishes, and street food culture. Features tacos, enchiladas, mole, and fresh salsas."
French,https://www.getflavor.com/wp-content/uploads/2019/01/4-Taureaux-Spread.jpg,"Renowned for its sophistication and influence on Western cuisine. Features rich sauces, pastries, and regional specialties. Known for techniques like julienning and flambéing, and dishes such as coq au vin and bouillabaisse."
Thai,https://tse2.mm.bing.net/th?id=OIP.jMKsmFt4l9ILNSiHiXvHuwHaFQ&pid=Api&P=0&h=180,"Aromatic cuisine balancing sweet, sour, salty, and spicy flavors. Known for curries, stir-fries, and salads featuring fresh herbs and vegetables. Popular dishes include pad thai, tom yum soup, and green curry."
